{
  "kind": "pagina",
  "id": "gk",
  "sentido": 0,
  "formato": "json",
  "camada": "descricao",
  "estatuto": "realizado",
  "evidencia": "legendas; limiar 12; X dim=8 e_k=2^k Gram=Id; vizdobra gera X; lei!=gerador!=realizacao; refs fisica.tex+catalogo.tex+corpo_universal.tex; tests/lei_gk_u.js",
  "proibicao": "CONGELADO; formula != lei; estrutura != lei; construcao != lei; teorema != tipo; teorema != objecto; mesmo enunciado notRightarrow mesmo objecto; desconhecido != ausente != novo tipo; desconhecido estrutural != algebrica; mesma expressao notRightarrow mesmo objecto; mesmo suporte notRightarrow mesma realizacao; alojamento = reconhecimento; subestrutura reconhecida != novo objecto; elemento/subestrutura subset construcao != novo objecto; propriedade interna notRightarrow entrada em ONTOLOGIA; localizado em X notRightarrow pertence a vizdobra; suporte != pertencimento a construcao; vive em X notRightarrow gerado por vizdobra; ontologia fechada por contencao; descoberta notRightarrow expande ONTOLOGIA; observado != construcao; V != X; objecto em V pede casa de V; xor != conv; C_f != *; C_f != hat != H; hat != chi != paridade; fator nao traduz para B; 2 != 0 em V/Zc nao autoriza 2mapsto0 em B; simbolo igual notRightarrow operacao igual; 2_V != 2_B; injetivo != invertivel; outra leitura do mesmo suporte nao cria casa; xor != * != F(f)F(g); oficio != categoria; parte nao acrescenta objectos; V_E != V; tres geometrias != tres objectos; d_ultra != d_Hamming != d_percurso; mesmo suporte notRightarrow mesma expressao; expressoes distintas notRightarrow objectos ontologicos distintos; propriedade da leitura != realizacao da expressao; B_cal != B; |N_T(x)|=1 != 2n; I != T; percurso != grafo; Euler != gerador; ciclo != lei; handshake != Euler; incidencia != grafo; grade != hipercubo; 2n != m; sigma_grade != sigma_B; n pares != 2n soltos; ordem 4 != ordem 2; binom(n,2) != 2n; codificar != linearizar; Peano != serpentina; I != V_grade; indice != conteudo; IxI != I; palavra != espaco; T_letra != T; alfabeto != A; comuta != cancela; G>1 != gerador; ker w != nucleo; pi != rho; buraco != dobra; folga != Duo; mesma folga != dois objectos; bijeccao != Iso; bijeccao != vizinhanca; posicional != vizinhanca; varphi != s; compor != acumular; d_x != D; T_trav != T; preco em pi != X; unica != duomorfa; Iso != Duo; D_op != D; interface != categoria; hexal != Duo; ligar != fundir; interface != transporte; T_fio != T; Q_ab != operadores de M; G=1 != Iso; eixo a != eixo G; duas especies != tres; igualdade estrutural != Iso; duas dobras != terceiro estado; tabua != objecto; compor = somar a; Q_sigma != Q_dt; quatro quadrantes != quatro objectos; centro != objecto; dois lados != duas casas; duas faces != dois objectos; equacao != nova lei; Star(U) != x^2=x+1; Star != Q_ab; Star != F8; Star != novo gerador; realizar em Zc != promover em B; reversivel != nova realizacao; Duo != Star; Duo reversivel != Iso; nao cria espaco; Q_ab != R_ij; quarteto != rotor; quatro estados != quatro geradores; localizado e incompativel => desconhecido; identidade=expressao>suporte>realizacao; peso != reua do card; paridade != chi != dual-smin; dtc != rotor != corpo-em; R_ij != gera/realiza/fixa/le; fecho != gerador; leitura != cadeia; relacao nao promove; e_k/dim/Gram/coord-byte nao sao leis; nao 6a lei; nao F8",
  "nota": "CONGELADO; 5 leis; ontologia fechada por contencao; funil localizar>suporte>expressao>realizacao>relacao>papel; Euler != gerador; ciclo != lei; handshake != Euler; incidencia != grafo; grade != hipercubo; 2n != m; sigma_grade != sigma_B; n pares != 2n soltos; ordem 4 != ordem 2; binom(n,2) != 2n; codificar != linearizar; Peano != serpentina; I != V_grade; indice != conteudo; IxI != I; palavra != espaco; T_letra != T; alfabeto != A; comuta != cancela; G>1 != gerador; ker w != nucleo; pi != rho; buraco != dobra; folga != Duo; mesma folga != dois objectos; bijeccao != Iso; bijeccao != vizinhanca; posicional != vizinhanca; varphi != s; compor != acumular; d_x != D; T_trav != T; preco em pi != X; unica != duomorfa; Iso != Duo; D_op != D; interface != categoria; hexal != Duo; ligar != fundir; interface != transporte; T_fio != T; Q_ab != operadores de M; G=1 != Iso; eixo a != eixo G; duas especies != tres; igualdade estrutural != Iso; duas dobras != terceiro estado; tabua != objecto; compor = somar a; Q_sigma != Q_dt; quatro quadrantes != quatro objectos; centro != objecto; dois lados != duas casas; duas faces != dois objectos; equacao != nova lei; Star(U) != x^2=x+1; Star != Q_ab; Star != F8; Star != novo gerador; realizar em Zc != promover em B; reversivel != nova realizacao; Duo != Star; Duo reversivel != Iso; chi_e aterra em leitura; ciclo em vizdobra; handshake conta local; so triade cruz=realizado"
}
